{
  "$schema": "./docs/site.config.schema.json",
  "slug": "jcwh-co-za",
  "client": "JC Wendy Houses",
  "sourceUrl": "https://www.jcwh.co.za/index.html",
  "base": {
    "version": "0.1.9",
    "tag": "base-v0.1.9"
  },
  "status": "reviewed",
  "deployTarget": "",
  "notes": "Tooling synced to base-v0.1.1 after the first crawl exposed legacy-markup gaps.",
  "runs": [
    {
      "at": "2026-09-28T08:37:16.636Z",
      "command": "modernize",
      "status": "generated",
      "pages": 4,
      "posts": 0,
      "services": 0,
      "redirects": 23
    },
    {
      "at": "2026-09-28T08:37:16.619Z",
      "command": "modernize",
      "status": "crawled",
      "pages": 23
    },
    {
      "at": "2026-09-28T08:26:06.022Z",
      "command": "generate",
      "status": "generated",
      "pages": 23,
      "posts": 0,
      "services": 0,
      "redirects": 23
    },
    {
      "at": "2026-09-28T08:12:33.526Z",
      "command": "modernize",
      "status": "generated",
      "pages": 23,
      "posts": 0,
      "services": 0,
      "redirects": 23
    },
    {
      "at": "2026-09-28T08:12:33.499Z",
      "command": "modernize",
      "status": "crawled",
      "pages": 23
    },
    {
      "at": "2026-09-28T07:43:46.066Z",
      "command": "modernize",
      "status": "generated",
      "pages": 23,
      "posts": 0,
      "services": 0,
      "redirects": 23
    },
    {
      "at": "2026-09-28T07:43:46.025Z",
      "command": "modernize",
      "status": "crawled",
      "pages": 23
    },
    {
      "at": "2026-09-28T07:41:18.192Z",
      "command": "modernize",
      "status": "generated",
      "pages": 23,
      "posts": 0,
      "services": 0,
      "redirects": 23
    },
    {
      "at": "2026-09-28T07:41:18.173Z",
      "command": "modernize",
      "status": "crawled",
      "pages": 23
    },
    {
      "at": "2026-09-28T07:31:14.824Z",
      "command": "modernize",
      "status": "generated",
      "pages": 23,
      "posts": 0,
      "services": 0,
      "redirects": 23
    },
    {
      "at": "2026-09-28T07:31:14.807Z",
      "command": "modernize",
      "status": "crawled",
      "pages": 23
    },
    {
      "at": "2026-09-28T07:28:15.194Z",
      "command": "modernize",
      "status": "generated",
      "pages": 23,
      "posts": 0,
      "services": 0,
      "redirects": 23
    },
    {
      "at": "2026-09-28T07:28:15.169Z",
      "command": "modernize",
      "status": "crawled",
      "pages": 23
    },
    {
      "at": "2026-09-28T07:25:28.995Z",
      "command": "modernize",
      "status": "generated",
      "pages": 23,
      "posts": 0,
      "services": 0,
      "redirects": 23
    },
    {
      "at": "2026-09-28T07:25:28.975Z",
      "command": "modernize",
      "status": "crawled",
      "pages": 23
    },
    {
      "at": "2026-09-28T07:22:03.354Z",
      "command": "modernize",
      "status": "generated",
      "pages": 23,
      "posts": 0,
      "services": 0,
      "redirects": 23
    },
    {
      "at": "2026-09-28T07:22:03.337Z",
      "command": "modernize",
      "status": "crawled",
      "pages": 23
    },
    {
      "at": "2026-09-28T07:17:34.336Z",
      "command": "modernize",
      "status": "generated",
      "pages": 23,
      "posts": 0,
      "services": 0,
      "redirects": 23
    },
    {
      "at": "2026-09-28T07:17:34.315Z",
      "command": "modernize",
      "status": "crawled",
      "pages": 23
    },
    {
      "at": "2026-09-28T07:12:51.797Z",
      "command": "modernize",
      "status": "generated",
      "pages": 23,
      "posts": 0,
      "services": 0,
      "redirects": 23
    }
  ]
}
